{
  "protocol": "codex-phase-flow/1",
  "flow_id": "v13-orchestration-debug",
  "task": "Certify child orchestration without project context",
  "context_catalog": {},
  "prompt_catalog": {},
  "phases": [
    {"id":"unit-00","phase":"PLANNING","phase_detail":"planner_prepare","model":"gpt-5.6-sol","reasoning":"low","sandbox":"workspace-write"},
    {"id":"unit-01","phase":"PLANNING","phase_detail":"planner_run","model":"gpt-5.6-sol","reasoning":"low","sandbox":"workspace-write"},
    {"id":"unit-02","phase":"PLANNING","phase_detail":"plan_validate","model":"gpt-5.6-sol","reasoning":"low","sandbox":"workspace-write"},
    {"id":"unit-03","phase":"PLANNING","phase_detail":"plan_render","model":"gpt-5.6-sol","reasoning":"low","sandbox":"workspace-write"},
    {"id":"unit-04","phase":"PLAN_REVIEW","phase_detail":"review_dispatch","model":"gpt-5.6-sol","reasoning":"low","sandbox":"workspace-write"},
    {"id":"unit-05","phase":"PLAN_REVIEW","phase_detail":"review_collect","model":"gpt-5.6-sol","reasoning":"low","sandbox":"workspace-write"},
    {"id":"unit-06","phase":"PLAN_REVIEW","phase_detail":"revise","model":"gpt-5.6-sol","reasoning":"low","sandbox":"workspace-write"},
    {"id":"unit-07","phase":"PLAN_REVIEW","phase_detail":"revised_plan_validate","model":"gpt-5.6-sol","reasoning":"low","sandbox":"workspace-write"},
    {"id":"unit-08","phase":"IMPLEMENTING","phase_detail":"strategy_validate","model":"gpt-5.6-sol","reasoning":"low","sandbox":"workspace-write"},
    {"id":"unit-09","phase":"IMPLEMENTING","phase_detail":"workers_dispatch","model":"gpt-5.6-sol","reasoning":"low","sandbox":"workspace-write"},
    {"id":"unit-10","phase":"IMPLEMENTING","phase_detail":"workers_collect","model":"gpt-5.6-sol","reasoning":"low","sandbox":"workspace-write"},
    {"id":"unit-11","phase":"IMPLEMENTING","phase_detail":"integration_validate","model":"gpt-5.6-sol","reasoning":"low","sandbox":"workspace-write"},
    {"id":"unit-12","phase":"RUNTIME_SMOKE","phase_detail":"smoke_a_run","model":"gpt-5.6-sol","reasoning":"low","sandbox":"workspace-write"},
    {"id":"unit-13","phase":"RUNTIME_SMOKE","phase_detail":"smoke_a_fix","model":"gpt-5.6-sol","reasoning":"low","sandbox":"workspace-write"},
    {"id":"unit-14","phase":"RUNTIME_SMOKE","phase_detail":"smoke_a_rerun","model":"gpt-5.6-sol","reasoning":"low","sandbox":"workspace-write"},
    {"id":"unit-15","phase":"REVIEWING","phase_detail":"review_dispatch","model":"gpt-5.6-sol","reasoning":"low","sandbox":"workspace-write"},
    {"id":"unit-16","phase":"REVIEWING","phase_detail":"ui_walk_plan","model":"gpt-5.6-sol","reasoning":"low","sandbox":"workspace-write"},
    {"id":"unit-17","phase":"REVIEWING","phase_detail":"score","model":"gpt-5.6-sol","reasoning":"low","sandbox":"workspace-write"},
    {"id":"unit-18","phase":"REVIEWING","phase_detail":"fix","model":"gpt-5.6-sol","reasoning":"low","sandbox":"workspace-write"},
    {"id":"unit-19","phase":"REVIEWING","phase_detail":"rereview","model":"gpt-5.6-sol","reasoning":"low","sandbox":"workspace-write"},
    {"id":"unit-20","phase":"REVIEWING","phase_detail":"review_finalize","model":"gpt-5.6-sol","reasoning":"low","sandbox":"workspace-write"},
    {"id":"unit-21","phase":"COMMITTING","phase_detail":"smoke_b_run","model":"gpt-5.6-sol","reasoning":"low","sandbox":"workspace-write"},
    {"id":"unit-22","phase":"COMMITTING","phase_detail":"smoke_b_fix","model":"gpt-5.6-sol","reasoning":"low","sandbox":"workspace-write"},
    {"id":"unit-23","phase":"COMMITTING","phase_detail":"ui_walk_run","model":"gpt-5.6-sol","reasoning":"low","sandbox":"workspace-write"},
    {"id":"unit-24","phase":"COMMITTING","phase_detail":"full_venv_run","model":"gpt-5.6-sol","reasoning":"low","sandbox":"workspace-write"},
    {"id":"unit-25","phase":"COMMITTING","phase_detail":"full_venv_fix","model":"gpt-5.6-sol","reasoning":"low","sandbox":"workspace-write"},
    {"id":"unit-26","phase":"COMMITTING","phase_detail":"final_gates","model":"gpt-5.6-sol","reasoning":"low","sandbox":"workspace-write"},
    {"id":"unit-27","phase":"COMMITTING","phase_detail":"feature_commit","model":"gpt-5.6-sol","reasoning":"low","sandbox":"workspace-write"},
    {"id":"unit-28","phase":"COMMITTING","phase_detail":"manifest_commit","model":"gpt-5.6-sol","reasoning":"low","sandbox":"workspace-write"},
    {"id":"unit-29","phase":"COMMITTING","phase_detail":"merge_prepare","model":"gpt-5.6-sol","reasoning":"low","sandbox":"workspace-write"},
    {"id":"unit-30","phase":"COMMITTING","phase_detail":"merge","model":"gpt-5.6-sol","reasoning":"low","sandbox":"workspace-write"},
    {"id":"unit-31","phase":"COMMITTING","phase_detail":"cleanup","model":"gpt-5.6-sol","reasoning":"low","sandbox":"workspace-write"}
  ]
}
